{
  "$schema": "https://json-schema.org/draft/2020-12/schema",
  "$id": "https://provenance-protocol.thesis/schemas/pipeline_bundle.schema.json",
  "title": "Pipeline Bundle",
  "description": "Top-level container wrapping all records for a single pipeline run. Carries the integrity seal (bundle_hash) and the disclosure flag. Primary EU AI Act mapping: Art. 12(1), 12(2), 50(1).",
  "type": "object",
  "additionalProperties": false,
  "required": [
    "bundle_id",
    "record_type",
    "protocol_version",
    "pipeline_id",
    "session_id",
    "created_at",
    "disclosure_presented",
    "records",
    "bundle_hash"
  ],
  "properties": {
    "bundle_id": {
      "$ref": "#/$defs/uuid",
      "description": "Unique identifier for this bundle. Schema metadata; no direct Act mapping."
    },
    "record_type": {
      "const": "pipeline_bundle",
      "description": "Discriminator identifying this object as a Pipeline Bundle."
    },
    "protocol_version": {
      "$ref": "#/$defs/semver",
      "description": "Provenance protocol version (semver). Schema metadata."
    },
    "pipeline_id": {
      "$ref": "#/$defs/uuid",
      "description": "Identifier of the pipeline this bundle captures. EU AI Act Art. 12(2)(c) — supports operational monitoring (Art. 26(5))."
    },
    "session_id": {
      "$ref": "#/$defs/uuid",
      "description": "Identifier of the execution session within the pipeline. EU AI Act Art. 12(2)(c) — supports operational monitoring."
    },
    "created_at": {
      "$ref": "#/$defs/iso8601_timestamp",
      "description": "ISO 8601 / RFC 3339 timestamp marking the moment the bundle was sealed (records list frozen, bundle_hash computed). Schema metadata supporting Art. 12(2) traceability."
    },
    "disclosure_presented": {
      "type": "boolean",
      "description": "Whether an AI-interaction disclosure was presented to the user during this pipeline run. EU AI Act Art. 50(1) — users must be informed they are interacting with an AI system."
    },
    "records": {
      "type": "array",
      "minItems": 1,
      "items": {
        "oneOf": [
          { "$ref": "https://provenance-protocol.thesis/schemas/agent_step.schema.json" },
          { "$ref": "https://provenance-protocol.thesis/schemas/tool_invocation.schema.json" },
          { "$ref": "https://provenance-protocol.thesis/schemas/human_intervention.schema.json" }
        ]
      },
      "description": "Ordered list of provenance records produced during the pipeline run. Each item must validate against exactly one of the Agent Step, Tool Invocation, or Human Intervention record schemas (discriminated by record_type). EU AI Act Art. 12(2) — the ordered chain is the traceability evidence."
    },
    "bundle_hash": {
      "$ref": "#/$defs/sha256_hex",
      "description": "SHA-256 hex digest computed over the canonical JSON of this bundle with the bundle_hash field itself removed. Provides a tamper-evident integrity seal for the entire record set. EU AI Act Art. 12(1) — the 'technically allow' obligation requires logs that are fit for evidentiary use, which mutable record sets are not. Verification recomputes the same exclusion-and-hash; mismatch indicates tampering. The canonical-JSON form used by the reference implementation (sorted keys, compact separators, UTF-8, ensure_ascii=false, no NaN/Infinity) is intentionally close to but not strictly RFC 8785 (JCS); independent verifiers must match the reference implementation's number formatting exactly to reproduce the digest."
    }
  },
  "$defs": {
    "uuid": {
      "type": "string",
      "pattern": "^[0-9a-f]{8}-[0-9a-f]{4}-[0-9a-f]{4}-[0-9a-f]{4}-[0-9a-f]{12}$",
      "description": "RFC 4122 UUID string in lowercase hex (canonical form for the protocol)."
    },
    "sha256_hex": {
      "type": "string",
      "pattern": "^[a-f0-9]{64}$",
      "description": "SHA-256 digest as 64 lowercase hex characters."
    },
    "iso8601_timestamp": {
      "type": "string",
      "format": "date-time",
      "description": "ISO 8601 / RFC 3339 timestamp with timezone."
    },
    "semver": {
      "type": "string",
      "pattern": "^(0|[1-9]\\d*)\\.(0|[1-9]\\d*)\\.(0|[1-9]\\d*)(?:-((?:0|[1-9]\\d*|\\d*[a-zA-Z-][0-9a-zA-Z-]*)(?:\\.(?:0|[1-9]\\d*|\\d*[a-zA-Z-][0-9a-zA-Z-]*))*))?(?:\\+([0-9a-zA-Z-]+(?:\\.[0-9a-zA-Z-]+)*))?$",
      "description": "Semantic version per semver.org."
    }
  }
}
