{
  "bundle_id": "a77fb83c-5a01-4a71-8da0-9664792210ba",
  "record_type": "pipeline_bundle",
  "protocol_version": "0.1.0",
  "pipeline_id": "b1f4a2d0-7c8e-4a1f-9b3d-6e5a8c2f4d11",
  "session_id": "b1c6686f-1135-4e44-b1a0-76669aa56786",
  "created_at": "2026-05-17T01:39:25.851580Z",
  "disclosure_presented": true,
  "records": [
    {
      "record_id": "4cdc3694-37f7-4f79-aa89-397b99ee77b3",
      "record_type": "tool_invocation",
      "protocol_version": "0.1.0",
      "pipeline_id": "b1f4a2d0-7c8e-4a1f-9b3d-6e5a8c2f4d11",
      "session_id": "b1c6686f-1135-4e44-b1a0-76669aa56786",
      "agent_id": "researcher",
      "tool_name": "web_search",
      "tool_version": "unversioned",
      "timestamp_start": "2026-05-17T01:39:14.798632Z",
      "timestamp_end": "2026-05-17T01:39:14.800343Z",
      "input_hash": "43db217faadadc58f3abec361efa0164ff518e9be78233ba677e8e2e5eed8baa",
      "output_hash": "a6ff9c0630131ec5f0417e6b2dee03e864f2dd81d76d3c4a93a6de6308cdd773",
      "reference_data_id": null,
      "parent_record_id": null
    },
    {
      "record_id": "2a0f8e95-a418-4326-bc04-48e86784af3c",
      "record_type": "agent_step",
      "protocol_version": "0.1.0",
      "pipeline_id": "b1f4a2d0-7c8e-4a1f-9b3d-6e5a8c2f4d11",
      "session_id": "b1c6686f-1135-4e44-b1a0-76669aa56786",
      "agent_id": "researcher",
      "model_id": "gpt-4o-mini",
      "model_version": "gpt-4o-mini",
      "timestamp_start": "2026-05-17T01:39:16.021466Z",
      "timestamp_end": "2026-05-17T01:39:20.537780Z",
      "input_hash": "2f011145c3803b0dca5b06d516f50b46e2f6a923e21d93323e1d7968441b5465",
      "output_hash": "06e11c312f2827b0b7c5aae1cccc14ca7cad056663d348c0e8b0aa37822159a4",
      "reference_data_id": null,
      "parent_record_id": "4cdc3694-37f7-4f79-aa89-397b99ee77b3"
    },
    {
      "record_id": "8531e391-d9d8-4c62-a037-774e5fa98cbd",
      "record_type": "agent_step",
      "protocol_version": "0.1.0",
      "pipeline_id": "b1f4a2d0-7c8e-4a1f-9b3d-6e5a8c2f4d11",
      "session_id": "b1c6686f-1135-4e44-b1a0-76669aa56786",
      "agent_id": "summarizer",
      "model_id": "gpt-4o-mini",
      "model_version": "gpt-4o-mini",
      "timestamp_start": "2026-05-17T01:39:20.543027Z",
      "timestamp_end": "2026-05-17T01:39:23.297508Z",
      "input_hash": "4029485cea07b022324b0bbdfa9a2e3048391ac5287dce2eabdf5018356886cd",
      "output_hash": "74f108333ea66811732f7ca40014e3d47ce27be75f150aa4190ea1b2ee4ef759",
      "reference_data_id": null,
      "parent_record_id": "2a0f8e95-a418-4326-bc04-48e86784af3c"
    },
    {
      "record_id": "fecc4569-aa9c-4f9f-be90-a07e49952c68",
      "record_type": "agent_step",
      "protocol_version": "0.1.0",
      "pipeline_id": "b1f4a2d0-7c8e-4a1f-9b3d-6e5a8c2f4d11",
      "session_id": "b1c6686f-1135-4e44-b1a0-76669aa56786",
      "agent_id": "writer",
      "model_id": "gpt-4o-mini",
      "model_version": "gpt-4o-mini",
      "timestamp_start": "2026-05-17T01:39:23.301110Z",
      "timestamp_end": "2026-05-17T01:39:25.850490Z",
      "input_hash": "e6b2132ef634bf6d903d06f1a086de6a29767122d14eda5dc8505eb479654365",
      "output_hash": "11264e1c3e4e9f02e43d9fbd84f919494c527d008554fbcaa4c98850405a30a5",
      "reference_data_id": null,
      "parent_record_id": "8531e391-d9d8-4c62-a037-774e5fa98cbd"
    }
  ],
  "bundle_hash": "09e4d1e5dea74863017f7d910498f41baa693960c03bdc6d70fcc751b6760d17"
}