{
  "bundle_id": "ac0ae800-55b1-4665-abc9-319d864cbd2a",
  "record_type": "pipeline_bundle",
  "protocol_version": "0.1.0",
  "pipeline_id": "8d3fecf8-42d6-4f45-824f-7dde23407026",
  "session_id": "787e219c-599c-4d62-be1d-c71bc3e84b8a",
  "created_at": "2026-05-12T15:52:50.519874Z",
  "disclosure_presented": true,
  "records": [
    {
      "record_id": "a9a2dacb-e7af-46d8-9d9f-15a5d7b51dc9",
      "record_type": "tool_invocation",
      "protocol_version": "0.1.0",
      "pipeline_id": "8d3fecf8-42d6-4f45-824f-7dde23407026",
      "session_id": "787e219c-599c-4d62-be1d-c71bc3e84b8a",
      "agent_id": "researcher",
      "tool_name": "web_search",
      "tool_version": "unversioned",
      "timestamp_start": "2026-05-12T15:52:50.514047Z",
      "timestamp_end": "2026-05-12T15:52:50.515431Z",
      "input_hash": "43db217faadadc58f3abec361efa0164ff518e9be78233ba677e8e2e5eed8baa",
      "output_hash": "a6ff9c0630131ec5f0417e6b2dee03e864f2dd81d76d3c4a93a6de6308cdd773",
      "reference_data_id": null,
      "parent_record_id": null
    },
    {
      "record_id": "f6f25455-b600-402d-aec0-ae20cd968fb9",
      "record_type": "agent_step",
      "protocol_version": "0.1.0",
      "pipeline_id": "8d3fecf8-42d6-4f45-824f-7dde23407026",
      "session_id": "787e219c-599c-4d62-be1d-c71bc3e84b8a",
      "agent_id": "researcher",
      "model_id": "fake-researcher",
      "model_version": "fake-researcher",
      "timestamp_start": "2026-05-12T15:52:50.515810Z",
      "timestamp_end": "2026-05-12T15:52:50.516403Z",
      "input_hash": "2463dde6d2c54c083a2d531b5d6d989f722bde7ab72b10a4d2b07c48e43cf457",
      "output_hash": "78177a3208b5fe424536117fb37da9c830e4051e5390714b452ac283195722d0",
      "reference_data_id": null,
      "parent_record_id": "a9a2dacb-e7af-46d8-9d9f-15a5d7b51dc9"
    },
    {
      "record_id": "e0db1ca2-3496-4732-89f9-dffa69379bee",
      "record_type": "agent_step",
      "protocol_version": "0.1.0",
      "pipeline_id": "8d3fecf8-42d6-4f45-824f-7dde23407026",
      "session_id": "787e219c-599c-4d62-be1d-c71bc3e84b8a",
      "agent_id": "summarizer",
      "model_id": "fake-summarizer",
      "model_version": "fake-summarizer",
      "timestamp_start": "2026-05-12T15:52:50.519147Z",
      "timestamp_end": "2026-05-12T15:52:50.519253Z",
      "input_hash": "d4c25b32fc56bba337de0a826b1b4f2bba6148c3429e1f21bbc72997a97703f4",
      "output_hash": "ad0f4b25a4fc05dac808162a345c578a08dbd3afd2329f140e82911b2dd2c973",
      "reference_data_id": null,
      "parent_record_id": "f6f25455-b600-402d-aec0-ae20cd968fb9"
    },
    {
      "record_id": "0ff01ab0-9497-4920-963f-42ede06094f8",
      "record_type": "agent_step",
      "protocol_version": "0.1.0",
      "pipeline_id": "8d3fecf8-42d6-4f45-824f-7dde23407026",
      "session_id": "787e219c-599c-4d62-be1d-c71bc3e84b8a",
      "agent_id": "writer",
      "model_id": "fake-writer",
      "model_version": "fake-writer",
      "timestamp_start": "2026-05-12T15:52:50.519617Z",
      "timestamp_end": "2026-05-12T15:52:50.519681Z",
      "input_hash": "eb884267372d8d4bdbe9fdeb207b8d5618775301e4c01073c2b69140a72ae880",
      "output_hash": "82cf59707e0b18d829d72abdeab6a41ff604587ecdadc9b33784fe5a8f24e440",
      "reference_data_id": null,
      "parent_record_id": "e0db1ca2-3496-4732-89f9-dffa69379bee"
    }
  ],
  "bundle_hash": "3e79a92b8481c02c74f1230247ed5c811530c58288ad2094bfce2281327275ca"
}