{
  "bundle_id": "147fac47-4b22-47b2-b14e-b7e4cd99ac00",
  "record_type": "pipeline_bundle",
  "protocol_version": "0.1.0",
  "pipeline_id": "b1f4a2d0-7c8e-4a1f-9b3d-6e5a8c2f4d11",
  "session_id": "aaccf8c3-224f-4ad9-a8c1-edbe1d8cd21f",
  "created_at": "2026-05-25T17:01:44.571305Z",
  "disclosure_presented": true,
  "records": [
    {
      "record_id": "43b1f809-7418-4531-9dec-9fe12730575c",
      "record_type": "tool_invocation",
      "protocol_version": "0.1.0",
      "pipeline_id": "b1f4a2d0-7c8e-4a1f-9b3d-6e5a8c2f4d11",
      "session_id": "aaccf8c3-224f-4ad9-a8c1-edbe1d8cd21f",
      "agent_id": "researcher",
      "tool_name": "web_search",
      "tool_version": "unversioned",
      "timestamp_start": "2026-05-25T17:01:32.088478Z",
      "timestamp_end": "2026-05-25T17:01:32.088724Z",
      "input_hash": "43db217faadadc58f3abec361efa0164ff518e9be78233ba677e8e2e5eed8baa",
      "output_hash": "a6ff9c0630131ec5f0417e6b2dee03e864f2dd81d76d3c4a93a6de6308cdd773",
      "reference_data_id": null,
      "parent_record_id": null
    },
    {
      "record_id": "005bd1fe-889e-464f-b55a-7211e9faa77d",
      "record_type": "agent_step",
      "protocol_version": "0.1.0",
      "pipeline_id": "b1f4a2d0-7c8e-4a1f-9b3d-6e5a8c2f4d11",
      "session_id": "aaccf8c3-224f-4ad9-a8c1-edbe1d8cd21f",
      "agent_id": "researcher",
      "model_id": "gpt-4o-mini",
      "model_version": "gpt-4o-mini",
      "timestamp_start": "2026-05-25T17:01:32.607439Z",
      "timestamp_end": "2026-05-25T17:01:38.725666Z",
      "input_hash": "6486564648484243e14e63cc5d94751a7b1c9abb4f65397b53b4541d620c9386",
      "output_hash": "7a2888a5c09d0bb349932f33b15b3732a5c85b033f8d398a5f2709bd518b5042",
      "reference_data_id": null,
      "parent_record_id": "43b1f809-7418-4531-9dec-9fe12730575c"
    },
    {
      "record_id": "6c1b2eab-1eef-4eb4-82b3-6269c83fbf07",
      "record_type": "agent_step",
      "protocol_version": "0.1.0",
      "pipeline_id": "b1f4a2d0-7c8e-4a1f-9b3d-6e5a8c2f4d11",
      "session_id": "aaccf8c3-224f-4ad9-a8c1-edbe1d8cd21f",
      "agent_id": "summarizer",
      "model_id": "gpt-4o-mini",
      "model_version": "gpt-4o-mini",
      "timestamp_start": "2026-05-25T17:01:38.727263Z",
      "timestamp_end": "2026-05-25T17:01:41.470844Z",
      "input_hash": "76415e04e3be3affa6139c2cdb3cecd0b25b8874ee70886d737c7c8dd370cf3d",
      "output_hash": "1abd0f21f8b22bd1ccf74c878ec66b8ce48fba5875f1a2de2cd5514113f8209a",
      "reference_data_id": null,
      "parent_record_id": "005bd1fe-889e-464f-b55a-7211e9faa77d"
    },
    {
      "record_id": "54b29193-081b-4f04-99bb-7f2e97a2fdd4",
      "record_type": "agent_step",
      "protocol_version": "0.1.0",
      "pipeline_id": "b1f4a2d0-7c8e-4a1f-9b3d-6e5a8c2f4d11",
      "session_id": "aaccf8c3-224f-4ad9-a8c1-edbe1d8cd21f",
      "agent_id": "writer",
      "model_id": "gpt-4o-mini",
      "model_version": "gpt-4o-mini",
      "timestamp_start": "2026-05-25T17:01:41.472184Z",
      "timestamp_end": "2026-05-25T17:01:44.570771Z",
      "input_hash": "9cc285c5fd1e4d5a434d4e8670d1d43ca308c49d56fcc76af5cb601f4409d4ac",
      "output_hash": "3993a4060610292382832767586c1f4b0b0dd2141604e43a3d7a10155269f15d",
      "reference_data_id": null,
      "parent_record_id": "6c1b2eab-1eef-4eb4-82b3-6269c83fbf07"
    }
  ],
  "bundle_hash": "c9c62a98c261e3e73e86861fef3531aeb2388ac990042fb8ed5e21a878432fc2"
}