{
  "bundle_id": "a96800d1-4c52-4a26-95ae-06927ea5e0c9",
  "record_type": "pipeline_bundle",
  "protocol_version": "0.1.0",
  "pipeline_id": "research-pipeline-v1",
  "session_id": "2ed2eae7-20e8-4024-abed-dfd80f521c5c",
  "created_at": "2026-05-12T09:50:34.381232Z",
  "disclosure_presented": true,
  "records": [
    {
      "record_id": "6e4050f7-e986-4264-a5ec-39eae85b9b01",
      "record_type": "tool_invocation",
      "protocol_version": "0.1.0",
      "pipeline_id": "research-pipeline-v1",
      "session_id": "2ed2eae7-20e8-4024-abed-dfd80f521c5c",
      "agent_id": "researcher",
      "tool_name": "web_search",
      "tool_version": "unversioned",
      "timestamp_start": "2026-05-12T09:50:34.377925Z",
      "timestamp_end": "2026-05-12T09:50:34.378940Z",
      "input_hash": "43db217faadadc58f3abec361efa0164ff518e9be78233ba677e8e2e5eed8baa",
      "output_hash": "a6ff9c0630131ec5f0417e6b2dee03e864f2dd81d76d3c4a93a6de6308cdd773",
      "reference_data_id": null,
      "parent_record_id": null
    },
    {
      "record_id": "4f03fa6f-4fac-4118-bdee-9403d57ca02a",
      "record_type": "agent_step",
      "protocol_version": "0.1.0",
      "pipeline_id": "research-pipeline-v1",
      "session_id": "2ed2eae7-20e8-4024-abed-dfd80f521c5c",
      "agent_id": "researcher",
      "model_id": "fake-researcher",
      "model_version": "fake-researcher",
      "timestamp_start": "2026-05-12T09:50:34.379262Z",
      "timestamp_end": "2026-05-12T09:50:34.379965Z",
      "input_hash": "2463dde6d2c54c083a2d531b5d6d989f722bde7ab72b10a4d2b07c48e43cf457",
      "output_hash": "4ddc01b82cf4a8ebd6b123e4a387b85a03eaa294b1a92340e7c36abf46df0cee",
      "reference_data_id": null,
      "parent_record_id": "6e4050f7-e986-4264-a5ec-39eae85b9b01"
    },
    {
      "record_id": "210fdeb5-05f5-4a20-8832-8d932e4496e8",
      "record_type": "agent_step",
      "protocol_version": "0.1.0",
      "pipeline_id": "research-pipeline-v1",
      "session_id": "2ed2eae7-20e8-4024-abed-dfd80f521c5c",
      "agent_id": "summarizer",
      "model_id": "fake-summarizer",
      "model_version": "fake-summarizer",
      "timestamp_start": "2026-05-12T09:50:34.380576Z",
      "timestamp_end": "2026-05-12T09:50:34.380652Z",
      "input_hash": "d4c25b32fc56bba337de0a826b1b4f2bba6148c3429e1f21bbc72997a97703f4",
      "output_hash": "adfa68bec992c93bfbf41dbbb55f2911b0c11a7bd75076311e3cabe464150f2f",
      "reference_data_id": null,
      "parent_record_id": "4f03fa6f-4fac-4118-bdee-9403d57ca02a"
    },
    {
      "record_id": "e487b306-6ebd-4c41-856b-77e7cf040309",
      "record_type": "agent_step",
      "protocol_version": "0.1.0",
      "pipeline_id": "research-pipeline-v1",
      "session_id": "2ed2eae7-20e8-4024-abed-dfd80f521c5c",
      "agent_id": "writer",
      "model_id": "fake-writer",
      "model_version": "fake-writer",
      "timestamp_start": "2026-05-12T09:50:34.380988Z",
      "timestamp_end": "2026-05-12T09:50:34.381052Z",
      "input_hash": "eb884267372d8d4bdbe9fdeb207b8d5618775301e4c01073c2b69140a72ae880",
      "output_hash": "e50b005985667d2ec71dc8aef6b4b845afc9be5323de71dbcefbc43d8bcfd25a",
      "reference_data_id": null,
      "parent_record_id": "210fdeb5-05f5-4a20-8832-8d932e4496e8"
    }
  ],
  "bundle_hash": "3abcd195e20362702b76360eae0542998637a0ba7b9034afef223c35b8cd2ce3"
}